{
  "claimId": "clm-ab07cefd-9504-47ca-ad6f-e7aadc57db20",
  "questionId": "q073",
  "claimText": "In live mode this text would be generated by the Abacus.AI model in response to the question: \"How should institutions handle procurement of AI tools — evaluation criteria, vendor accountability, contract terms, and exit strategies?\".",
  "status": "active",
  "version": 1,
  "validityInterval": {
    "validFrom": "2026-08-23",
    "validUntil": null
  },
  "confidence": {
    "score": 0.33,
    "level": "low"
  },
  "provenanceEdges": [
    {
      "sourceId": "src-edb0383b547d",
      "url": "https://example.com/mock/q073",
      "relation": "supports",
      "credibility": "medium"
    }
  ],
  "contradictionStatus": "none",
  "disputeStatus": "none",
  "contradicts": [],
  "meta": {
    "normalizedText": "in live mode this text would be generated by the abacusai model in response to the question how should institutions handle procurement of ai tools  evaluation criteria vendor accountability contract terms and exit strategies",
    "questionText": "How should institutions handle procurement of AI tools — evaluation criteria, vendor accountability, contract terms, and exit strategies?",
    "createdAt": "2026-08-23T22:23:29Z",
    "updatedAt": "2026-08-23T22:23:29Z",
    "supportingSourceCount": 1,
    "builder": "consistency-review.mjs"
  }
}
