{
  "claimId": "clm-87996819-ef1d-470f-9c83-6faf433d83eb",
  "questionId": "q045",
  "claimText": "In live mode this text would be generated by the Abacus.AI model in response to the question: \"How should education respond to the possible decoupling of learning from employment (if AI displaces large categories of work)?\".",
  "status": "active",
  "version": 1,
  "validityInterval": {
    "validFrom": "2026-08-23",
    "validUntil": null
  },
  "confidence": {
    "score": 0.33,
    "level": "low"
  },
  "provenanceEdges": [
    {
      "sourceId": "src-052269037742",
      "url": "https://example.com/mock/q045",
      "relation": "supports",
      "credibility": "medium"
    }
  ],
  "contradictionStatus": "none",
  "disputeStatus": "none",
  "contradicts": [],
  "meta": {
    "normalizedText": "in live mode this text would be generated by the abacusai model in response to the question how should education respond to the possible decoupling of learning from employment if ai displaces large categories of work",
    "questionText": "How should education respond to the possible decoupling of learning from employment (if AI displaces large categories of work)?",
    "createdAt": "2026-08-23T22:23:29Z",
    "updatedAt": "2026-08-23T22:23:29Z",
    "supportingSourceCount": 1,
    "builder": "consistency-review.mjs"
  }
}
