{
  "claimId": "clm-6292d2ae-db8e-480b-9dd7-191140291ef6",
  "questionId": "q022",
  "claimText": "In live mode this text would be generated by the Abacus.AI model in response to the question: \"How should the teacher's role be redefined — from transmitter of knowledge to what, exactly?\".",
  "status": "active",
  "version": 1,
  "validityInterval": {
    "validFrom": "2026-08-23",
    "validUntil": null
  },
  "confidence": {
    "score": 0.33,
    "level": "low"
  },
  "provenanceEdges": [
    {
      "sourceId": "src-3c649a42a016",
      "url": "https://example.com/mock/q022",
      "relation": "supports",
      "credibility": "medium"
    }
  ],
  "contradictionStatus": "none",
  "disputeStatus": "none",
  "contradicts": [],
  "meta": {
    "normalizedText": "in live mode this text would be generated by the abacusai model in response to the question how should the teachers role be redefined  from transmitter of knowledge to what exactly",
    "questionText": "How should the teacher's role be redefined — from transmitter of knowledge to what, exactly?",
    "createdAt": "2026-08-23T22:23:29Z",
    "updatedAt": "2026-08-23T22:23:29Z",
    "supportingSourceCount": 1,
    "builder": "consistency-review.mjs"
  }
}
