{
  "claimId": "clm-76b91a78-270b-4067-906f-f8873123c2cb",
  "questionId": "q085",
  "claimText": "In live mode this text would be generated by the Abacus.AI model in response to the question: \"How should institutions structure professional development so teachers gain real AI competence rather than one-off training?\".",
  "status": "active",
  "version": 1,
  "validityInterval": {
    "validFrom": "2026-08-23",
    "validUntil": null
  },
  "confidence": {
    "score": 0.33,
    "level": "low"
  },
  "provenanceEdges": [
    {
      "sourceId": "src-a35cd4a1ff9b",
      "url": "https://example.com/mock/q085",
      "relation": "supports",
      "credibility": "medium"
    }
  ],
  "contradictionStatus": "none",
  "disputeStatus": "none",
  "contradicts": [],
  "meta": {
    "normalizedText": "in live mode this text would be generated by the abacusai model in response to the question how should institutions structure professional development so teachers gain real ai competence rather than oneoff training",
    "questionText": "How should institutions structure professional development so teachers gain real AI competence rather than one-off training?",
    "createdAt": "2026-08-23T22:23:29Z",
    "updatedAt": "2026-08-23T22:23:29Z",
    "supportingSourceCount": 1,
    "builder": "consistency-review.mjs"
  }
}
