{
  "claimId": "clm-a87e858b-5ca7-4155-b324-d6e09c5a27de",
  "questionId": "q087",
  "claimText": "In live mode this text would be generated by the Abacus.AI model in response to the question: \"What technical and organizational safeguards (age gates, data controls, human oversight, escalation paths) should any classroom AI deployment include?\".",
  "status": "active",
  "version": 1,
  "validityInterval": {
    "validFrom": "2026-08-23",
    "validUntil": null
  },
  "confidence": {
    "score": 0.33,
    "level": "low"
  },
  "provenanceEdges": [
    {
      "sourceId": "src-2b1662e355a4",
      "url": "https://example.com/mock/q087",
      "relation": "supports",
      "credibility": "medium"
    }
  ],
  "contradictionStatus": "none",
  "disputeStatus": "none",
  "contradicts": [],
  "meta": {
    "normalizedText": "in live mode this text would be generated by the abacusai model in response to the question what technical and organizational safeguards age gates data controls human oversight escalation paths should any classroom ai deployment include",
    "questionText": "What technical and organizational safeguards (age gates, data controls, human oversight, escalation paths) should any classroom AI deployment include?",
    "createdAt": "2026-08-23T22:23:29Z",
    "updatedAt": "2026-08-23T22:23:29Z",
    "supportingSourceCount": 1,
    "builder": "consistency-review.mjs"
  }
}
