{
  "claimId": "clm-0867e996-e4af-4ce7-a80a-4db41faa55f8",
  "questionId": "q081",
  "claimText": "In live mode this text would be generated by the Abacus.AI model in response to the question: \"How should students use AI as a study partner in ways that demonstrably strengthen rather than weaken their learning?\".",
  "status": "active",
  "version": 1,
  "validityInterval": {
    "validFrom": "2026-08-23",
    "validUntil": null
  },
  "confidence": {
    "score": 0.33,
    "level": "low"
  },
  "provenanceEdges": [
    {
      "sourceId": "src-f218c8e74b31",
      "url": "https://example.com/mock/q081",
      "relation": "supports",
      "credibility": "medium"
    }
  ],
  "contradictionStatus": "none",
  "disputeStatus": "none",
  "contradicts": [],
  "meta": {
    "normalizedText": "in live mode this text would be generated by the abacusai model in response to the question how should students use ai as a study partner in ways that demonstrably strengthen rather than weaken their learning",
    "questionText": "How should students use AI as a study partner in ways that demonstrably strengthen rather than weaken their learning?",
    "createdAt": "2026-08-23T22:23:29Z",
    "updatedAt": "2026-08-23T22:23:29Z",
    "supportingSourceCount": 1,
    "builder": "consistency-review.mjs"
  }
}
