{
  "claimId": "clm-f9c458ca-fe5a-4394-af4f-e7b56a7ee464",
  "questionId": "q039",
  "claimText": "In live mode this text would be generated by the Abacus.AI model in response to the question: \"How should curricula be redesigned when factual content is instantly accessible and rapidly obsolete?\".",
  "status": "active",
  "version": 1,
  "validityInterval": {
    "validFrom": "2026-08-23",
    "validUntil": null
  },
  "confidence": {
    "score": 0.33,
    "level": "low"
  },
  "provenanceEdges": [
    {
      "sourceId": "src-3e2b625dc5ba",
      "url": "https://example.com/mock/q039",
      "relation": "supports",
      "credibility": "medium"
    }
  ],
  "contradictionStatus": "none",
  "disputeStatus": "none",
  "contradicts": [],
  "meta": {
    "normalizedText": "in live mode this text would be generated by the abacusai model in response to the question how should curricula be redesigned when factual content is instantly accessible and rapidly obsolete",
    "questionText": "How should curricula be redesigned when factual content is instantly accessible and rapidly obsolete?",
    "createdAt": "2026-08-23T22:23:29Z",
    "updatedAt": "2026-08-23T22:23:29Z",
    "supportingSourceCount": 1,
    "builder": "consistency-review.mjs"
  }
}
