{
  "claimId": "clm-1c90526b-2d07-450e-948d-36d84c083e66",
  "questionId": "q075",
  "claimText": "In live mode this text would be generated by the Abacus.AI model in response to the question: \"What academic-integrity frameworks have institutions adopted to replace binary \"cheating/not cheating\" models, and how are they working?\".",
  "status": "active",
  "version": 1,
  "validityInterval": {
    "validFrom": "2026-08-23",
    "validUntil": null
  },
  "confidence": {
    "score": 0.33,
    "level": "low"
  },
  "provenanceEdges": [
    {
      "sourceId": "src-58b0622fc1ef",
      "url": "https://example.com/mock/q075",
      "relation": "supports",
      "credibility": "medium"
    }
  ],
  "contradictionStatus": "none",
  "disputeStatus": "none",
  "contradicts": [],
  "meta": {
    "normalizedText": "in live mode this text would be generated by the abacusai model in response to the question what academicintegrity frameworks have institutions adopted to replace binary cheatingnot cheating models and how are they working",
    "questionText": "What academic-integrity frameworks have institutions adopted to replace binary \"cheating/not cheating\" models, and how are they working?",
    "createdAt": "2026-08-23T22:23:29Z",
    "updatedAt": "2026-08-23T22:23:29Z",
    "supportingSourceCount": 1,
    "builder": "consistency-review.mjs"
  }
}
