{
  "claimId": "clm-fca50be7-e93d-443e-b051-dc2e26ed0f9c",
  "questionId": "q090",
  "claimText": "In live mode this text would be generated by the Abacus.AI model in response to the question: \"What standards of evidence should decision makers demand from edtech vendors before adopting AI products at scale?\".",
  "status": "active",
  "version": 1,
  "validityInterval": {
    "validFrom": "2026-08-23",
    "validUntil": null
  },
  "confidence": {
    "score": 0.33,
    "level": "low"
  },
  "provenanceEdges": [
    {
      "sourceId": "src-27ec3635218d",
      "url": "https://example.com/mock/q090",
      "relation": "supports",
      "credibility": "medium"
    }
  ],
  "contradictionStatus": "none",
  "disputeStatus": "none",
  "contradicts": [],
  "meta": {
    "normalizedText": "in live mode this text would be generated by the abacusai model in response to the question what standards of evidence should decision makers demand from edtech vendors before adopting ai products at scale",
    "questionText": "What standards of evidence should decision makers demand from edtech vendors before adopting AI products at scale?",
    "createdAt": "2026-08-23T22:23:29Z",
    "updatedAt": "2026-08-23T22:23:29Z",
    "supportingSourceCount": 1,
    "builder": "consistency-review.mjs"
  }
}
