{
  "claimId": "clm-3b96ea93-7500-437f-a0d2-96b263abbb14",
  "questionId": "q018",
  "claimText": "In live mode this text would be generated by the Abacus.AI model in response to the question: \"Should there be a \"right to a human teacher,\" analogous to a right to human medical care?\".",
  "status": "active",
  "version": 1,
  "validityInterval": {
    "validFrom": "2026-08-23",
    "validUntil": null
  },
  "confidence": {
    "score": 0.33,
    "level": "low"
  },
  "provenanceEdges": [
    {
      "sourceId": "src-59adb74a0190",
      "url": "https://example.com/mock/q018",
      "relation": "supports",
      "credibility": "medium"
    }
  ],
  "contradictionStatus": "none",
  "disputeStatus": "none",
  "contradicts": [],
  "meta": {
    "normalizedText": "in live mode this text would be generated by the abacusai model in response to the question should there be a right to a human teacher analogous to a right to human medical care",
    "questionText": "Should there be a \"right to a human teacher,\" analogous to a right to human medical care?",
    "createdAt": "2026-08-23T22:23:29Z",
    "updatedAt": "2026-08-23T22:23:29Z",
    "supportingSourceCount": 1,
    "builder": "consistency-review.mjs"
  }
}
