{
  "claimId": "clm-5d70c399-6096-4156-99b2-7824e5e01b72",
  "questionId": "q020",
  "claimText": "In live mode this text would be generated by the Abacus.AI model in response to the question: \"What ethical obligations do AI companies have toward education systems they disrupt but do not serve?\".",
  "status": "active",
  "version": 1,
  "validityInterval": {
    "validFrom": "2026-08-23",
    "validUntil": null
  },
  "confidence": {
    "score": 0.33,
    "level": "low"
  },
  "provenanceEdges": [
    {
      "sourceId": "src-df6fda127f16",
      "url": "https://example.com/mock/q020",
      "relation": "supports",
      "credibility": "medium"
    }
  ],
  "contradictionStatus": "none",
  "disputeStatus": "none",
  "contradicts": [],
  "meta": {
    "normalizedText": "in live mode this text would be generated by the abacusai model in response to the question what ethical obligations do ai companies have toward education systems they disrupt but do not serve",
    "questionText": "What ethical obligations do AI companies have toward education systems they disrupt but do not serve?",
    "createdAt": "2026-08-23T22:23:29Z",
    "updatedAt": "2026-08-23T22:23:29Z",
    "supportingSourceCount": 1,
    "builder": "consistency-review.mjs"
  }
}
