{
  "claimId": "clm-5eadb761-bb1e-4a9e-8505-70fc34f851f7",
  "questionId": "q007",
  "claimText": "In live mode this text would be generated by the Abacus.AI model in response to the question: \"Should education aim to make humans complementary to AI, resistant to it, or independent of it?\".",
  "status": "active",
  "version": 1,
  "validityInterval": {
    "validFrom": "2026-08-23",
    "validUntil": null
  },
  "confidence": {
    "score": 0.33,
    "level": "low"
  },
  "provenanceEdges": [
    {
      "sourceId": "src-d96742de51d6",
      "url": "https://example.com/mock/q007",
      "relation": "supports",
      "credibility": "medium"
    }
  ],
  "contradictionStatus": "none",
  "disputeStatus": "none",
  "contradicts": [],
  "meta": {
    "normalizedText": "in live mode this text would be generated by the abacusai model in response to the question should education aim to make humans complementary to ai resistant to it or independent of it",
    "questionText": "Should education aim to make humans complementary to AI, resistant to it, or independent of it?",
    "createdAt": "2026-08-23T22:23:29Z",
    "updatedAt": "2026-08-23T22:23:29Z",
    "supportingSourceCount": 1,
    "builder": "consistency-review.mjs"
  }
}
