{
  "claimId": "clm-44fad520-3d53-45c5-9640-5813229ab78c",
  "questionId": "q092",
  "claimText": "In live mode this text would be generated by the Abacus.AI model in response to the question: \"What is known about the longitudinal effects of sustained AI use on learners, and how should long-term studies be designed and tracked?\".",
  "status": "active",
  "version": 1,
  "validityInterval": {
    "validFrom": "2026-08-23",
    "validUntil": null
  },
  "confidence": {
    "score": 0.33,
    "level": "low"
  },
  "provenanceEdges": [
    {
      "sourceId": "src-aa3852cefc11",
      "url": "https://example.com/mock/q092",
      "relation": "supports",
      "credibility": "medium"
    }
  ],
  "contradictionStatus": "none",
  "disputeStatus": "none",
  "contradicts": [],
  "meta": {
    "normalizedText": "in live mode this text would be generated by the abacusai model in response to the question what is known about the longitudinal effects of sustained ai use on learners and how should longterm studies be designed and tracked",
    "questionText": "What is known about the longitudinal effects of sustained AI use on learners, and how should long-term studies be designed and tracked?",
    "createdAt": "2026-08-23T22:23:29Z",
    "updatedAt": "2026-08-23T22:23:29Z",
    "supportingSourceCount": 1,
    "builder": "consistency-review.mjs"
  }
}
