{
  "claimId": "clm-22767f05-ef6a-4937-ae3a-4ee2d19d327a",
  "questionId": "q026",
  "claimText": "In live mode this text would be generated by the Abacus.AI model in response to the question: \"How should teacher training change so educators can critically use, evaluate, and challenge AI tools?\".",
  "status": "active",
  "version": 1,
  "validityInterval": {
    "validFrom": "2026-08-23",
    "validUntil": null
  },
  "confidence": {
    "score": 0.33,
    "level": "low"
  },
  "provenanceEdges": [
    {
      "sourceId": "src-5288c6f52bf6",
      "url": "https://example.com/mock/q026",
      "relation": "supports",
      "credibility": "medium"
    }
  ],
  "contradictionStatus": "none",
  "disputeStatus": "none",
  "contradicts": [],
  "meta": {
    "normalizedText": "in live mode this text would be generated by the abacusai model in response to the question how should teacher training change so educators can critically use evaluate and challenge ai tools",
    "questionText": "How should teacher training change so educators can critically use, evaluate, and challenge AI tools?",
    "createdAt": "2026-08-23T22:23:29Z",
    "updatedAt": "2026-08-23T22:23:29Z",
    "supportingSourceCount": 1,
    "builder": "consistency-review.mjs"
  }
}
