{
  "claimId": "clm-7c1053f5-f5d6-4abc-95ae-7ec379e985b0",
  "questionId": "q093",
  "claimText": "In live mode this text would be generated by the Abacus.AI model in response to the question: \"How should learning analytics generated by AI systems be interpreted, validated, and protected from misuse in student evaluation?\".",
  "status": "active",
  "version": 1,
  "validityInterval": {
    "validFrom": "2026-08-23",
    "validUntil": null
  },
  "confidence": {
    "score": 0.33,
    "level": "low"
  },
  "provenanceEdges": [
    {
      "sourceId": "src-fc5b73dfa203",
      "url": "https://example.com/mock/q093",
      "relation": "supports",
      "credibility": "medium"
    }
  ],
  "contradictionStatus": "none",
  "disputeStatus": "none",
  "contradicts": [],
  "meta": {
    "normalizedText": "in live mode this text would be generated by the abacusai model in response to the question how should learning analytics generated by ai systems be interpreted validated and protected from misuse in student evaluation",
    "questionText": "How should learning analytics generated by AI systems be interpreted, validated, and protected from misuse in student evaluation?",
    "createdAt": "2026-08-23T22:23:29Z",
    "updatedAt": "2026-08-23T22:23:29Z",
    "supportingSourceCount": 1,
    "builder": "consistency-review.mjs"
  }
}
