{
  "claimId": "clm-8e8815a0-10d9-4e2c-b973-f43cbaea8d93",
  "questionId": "q078",
  "claimText": "In live mode this text would be generated by the Abacus.AI model in response to the question: \"How should a teacher decide, lesson by lesson, when AI use helps learning and when it undermines it — is there a practical decision framework?\".",
  "status": "active",
  "version": 1,
  "validityInterval": {
    "validFrom": "2026-08-23",
    "validUntil": null
  },
  "confidence": {
    "score": 0.33,
    "level": "low"
  },
  "provenanceEdges": [
    {
      "sourceId": "src-57d5ccb3c60a",
      "url": "https://example.com/mock/q078",
      "relation": "supports",
      "credibility": "medium"
    }
  ],
  "contradictionStatus": "none",
  "disputeStatus": "none",
  "contradicts": [],
  "meta": {
    "normalizedText": "in live mode this text would be generated by the abacusai model in response to the question how should a teacher decide lesson by lesson when ai use helps learning and when it undermines it  is there a practical decision framework",
    "questionText": "How should a teacher decide, lesson by lesson, when AI use helps learning and when it undermines it — is there a practical decision framework?",
    "createdAt": "2026-08-23T22:23:29Z",
    "updatedAt": "2026-08-23T22:23:29Z",
    "supportingSourceCount": 1,
    "builder": "consistency-review.mjs"
  }
}
