{
  "claimId": "clm-4620ea86-cf12-4e67-aa91-a60d951eb3ba",
  "questionId": "q049",
  "claimText": "In live mode this text would be generated by the Abacus.AI model in response to the question: \"What shared human culture and values should education transmit when AI fragments information into personalized realities?\".",
  "status": "active",
  "version": 1,
  "validityInterval": {
    "validFrom": "2026-08-23",
    "validUntil": null
  },
  "confidence": {
    "score": 0.33,
    "level": "low"
  },
  "provenanceEdges": [
    {
      "sourceId": "src-5ea6ae57afc7",
      "url": "https://example.com/mock/q049",
      "relation": "supports",
      "credibility": "medium"
    }
  ],
  "contradictionStatus": "none",
  "disputeStatus": "none",
  "contradicts": [],
  "meta": {
    "normalizedText": "in live mode this text would be generated by the abacusai model in response to the question what shared human culture and values should education transmit when ai fragments information into personalized realities",
    "questionText": "What shared human culture and values should education transmit when AI fragments information into personalized realities?",
    "createdAt": "2026-08-23T22:23:29Z",
    "updatedAt": "2026-08-23T22:23:29Z",
    "supportingSourceCount": 1,
    "builder": "consistency-review.mjs"
  }
}
