{
  "claimId": "clm-2e9da827-7b01-4a67-8144-466616ab175a",
  "questionId": "q083",
  "claimText": "In live mode this text would be generated by the Abacus.AI model in response to the question: \"How should students disclose and document their AI use in academic work, and how can they build integrity habits that also serve them professionally?\".",
  "status": "active",
  "version": 1,
  "validityInterval": {
    "validFrom": "2026-08-23",
    "validUntil": null
  },
  "confidence": {
    "score": 0.33,
    "level": "low"
  },
  "provenanceEdges": [
    {
      "sourceId": "src-578564ef5340",
      "url": "https://example.com/mock/q083",
      "relation": "supports",
      "credibility": "medium"
    }
  ],
  "contradictionStatus": "none",
  "disputeStatus": "none",
  "contradicts": [],
  "meta": {
    "normalizedText": "in live mode this text would be generated by the abacusai model in response to the question how should students disclose and document their ai use in academic work and how can they build integrity habits that also serve them professionally",
    "questionText": "How should students disclose and document their AI use in academic work, and how can they build integrity habits that also serve them professionally?",
    "createdAt": "2026-08-23T22:23:29Z",
    "updatedAt": "2026-08-23T22:23:29Z",
    "supportingSourceCount": 1,
    "builder": "consistency-review.mjs"
  }
}
