{
  "claimId": "clm-0c7a945e-bffe-4d7e-ba5a-476c151c8cc5",
  "questionId": "q024",
  "claimText": "In live mode this text would be generated by the Abacus.AI model in response to the question: \"How can AI support teachers (planning, assessment, feedback) without deskilling or replacing them?\".",
  "status": "active",
  "version": 1,
  "validityInterval": {
    "validFrom": "2026-08-23",
    "validUntil": null
  },
  "confidence": {
    "score": 0.33,
    "level": "low"
  },
  "provenanceEdges": [
    {
      "sourceId": "src-7224637d612e",
      "url": "https://example.com/mock/q024",
      "relation": "supports",
      "credibility": "medium"
    }
  ],
  "contradictionStatus": "none",
  "disputeStatus": "none",
  "contradicts": [],
  "meta": {
    "normalizedText": "in live mode this text would be generated by the abacusai model in response to the question how can ai support teachers planning assessment feedback without deskilling or replacing them",
    "questionText": "How can AI support teachers (planning, assessment, feedback) without deskilling or replacing them?",
    "createdAt": "2026-08-23T22:23:29Z",
    "updatedAt": "2026-08-23T22:23:29Z",
    "supportingSourceCount": 1,
    "builder": "consistency-review.mjs"
  }
}
