{
  "claimId": "clm-284763c8-7f88-4227-a269-dd716be5062b",
  "questionId": "q030",
  "claimText": "In live mode this text would be generated by the Abacus.AI model in response to the question: \"How do we design AI systems that strengthen rather than substitute students' thinking (avoiding cognitive offloading)?\".",
  "status": "active",
  "version": 1,
  "validityInterval": {
    "validFrom": "2026-08-23",
    "validUntil": null
  },
  "confidence": {
    "score": 0.33,
    "level": "low"
  },
  "provenanceEdges": [
    {
      "sourceId": "src-53c0a6208b7f",
      "url": "https://example.com/mock/q030",
      "relation": "supports",
      "credibility": "medium"
    }
  ],
  "contradictionStatus": "none",
  "disputeStatus": "none",
  "contradicts": [],
  "meta": {
    "normalizedText": "in live mode this text would be generated by the abacusai model in response to the question how do we design ai systems that strengthen rather than substitute students thinking avoiding cognitive offloading",
    "questionText": "How do we design AI systems that strengthen rather than substitute students' thinking (avoiding cognitive offloading)?",
    "createdAt": "2026-08-23T22:23:29Z",
    "updatedAt": "2026-08-23T22:23:29Z",
    "supportingSourceCount": 1,
    "builder": "consistency-review.mjs"
  }
}
