{
  "claimId": "clm-ea98a51b-c19a-481e-be62-d9e77e17205c",
  "questionId": "q082",
  "claimText": "In live mode this text would be generated by the Abacus.AI model in response to the question: \"What should students know about the limits, failure modes, and biases of AI systems before trusting their outputs?\".",
  "status": "active",
  "version": 1,
  "validityInterval": {
    "validFrom": "2026-08-23",
    "validUntil": null
  },
  "confidence": {
    "score": 0.33,
    "level": "low"
  },
  "provenanceEdges": [
    {
      "sourceId": "src-f1a1950e6b92",
      "url": "https://example.com/mock/q082",
      "relation": "supports",
      "credibility": "medium"
    }
  ],
  "contradictionStatus": "none",
  "disputeStatus": "none",
  "contradicts": [],
  "meta": {
    "normalizedText": "in live mode this text would be generated by the abacusai model in response to the question what should students know about the limits failure modes and biases of ai systems before trusting their outputs",
    "questionText": "What should students know about the limits, failure modes, and biases of AI systems before trusting their outputs?",
    "createdAt": "2026-08-23T22:23:29Z",
    "updatedAt": "2026-08-23T22:23:29Z",
    "supportingSourceCount": 1,
    "builder": "consistency-review.mjs"
  }
}
