{
  "claimId": "clm-0704f2ac-3a95-4175-a1ad-59d29978cfb2",
  "questionId": "q012",
  "claimText": "In live mode this text would be generated by the Abacus.AI model in response to the question: \"How should student data collected by AI systems be governed, and who owns the learning profile of a child?\".",
  "status": "active",
  "version": 1,
  "validityInterval": {
    "validFrom": "2026-08-23",
    "validUntil": null
  },
  "confidence": {
    "score": 0.33,
    "level": "low"
  },
  "provenanceEdges": [
    {
      "sourceId": "src-067e44b1b0c1",
      "url": "https://example.com/mock/q012",
      "relation": "supports",
      "credibility": "medium"
    }
  ],
  "contradictionStatus": "none",
  "disputeStatus": "none",
  "contradicts": [],
  "meta": {
    "normalizedText": "in live mode this text would be generated by the abacusai model in response to the question how should student data collected by ai systems be governed and who owns the learning profile of a child",
    "questionText": "How should student data collected by AI systems be governed, and who owns the learning profile of a child?",
    "createdAt": "2026-08-23T22:23:29Z",
    "updatedAt": "2026-08-23T22:23:29Z",
    "supportingSourceCount": 1,
    "builder": "consistency-review.mjs"
  }
}
