{
  "claimId": "clm-15be1dc5-c01b-42df-a6fd-171fe9b0dfb9",
  "questionId": "q013",
  "claimText": "In live mode this text would be generated by the Abacus.AI model in response to the question: \"Does personalized AI tutoring risk creating algorithmic determinism — locking students into predicted trajectories?\".",
  "status": "active",
  "version": 1,
  "validityInterval": {
    "validFrom": "2026-08-23",
    "validUntil": null
  },
  "confidence": {
    "score": 0.33,
    "level": "low"
  },
  "provenanceEdges": [
    {
      "sourceId": "src-b614f84e4aac",
      "url": "https://example.com/mock/q013",
      "relation": "supports",
      "credibility": "medium"
    }
  ],
  "contradictionStatus": "none",
  "disputeStatus": "none",
  "contradicts": [],
  "meta": {
    "normalizedText": "in live mode this text would be generated by the abacusai model in response to the question does personalized ai tutoring risk creating algorithmic determinism  locking students into predicted trajectories",
    "questionText": "Does personalized AI tutoring risk creating algorithmic determinism — locking students into predicted trajectories?",
    "createdAt": "2026-08-23T22:23:29Z",
    "updatedAt": "2026-08-23T22:23:29Z",
    "supportingSourceCount": 1,
    "builder": "consistency-review.mjs"
  }
}
